rule_id,target_attribute,target_attribute_type,validation_rules,translation_rules,description,desc_uptodate_with_rules
0,ROW_TRANSLATION_RULE,NA,"nb_nbi01_wetland_validation(wc, vt, im, 1)",NA,"Translate only when one of wc, vt OR im is not NULL",TRUE
1,CAS_ID,text,notEmpty(inventory_id);notNull(orig_stand_id);notNull(src_filename);notNull(ogc_fid),"padConcat({inventory_id, src_filename, '', orig_stand_id, ogc_fid}, {4,15,10,10,7}, {'x','x','x','0','0'}, '-', 'TRUE', 'TRUE')",Concatenates five attributes to create CAS_ID,TRUE
2,WETLAND_TYPE,text,"nb_nbi01_wetland_validation(wc, vt, im, 1)","nb_nbi01_wetland_translation(wc, vt, im, 1)",Check there is a value. Translation converts source attributes into 4-character wetland code and returns the code corresponding to the first character.,TRUE
3,WET_VEG_COVER,text,"nb_nbi01_wetland_validation(wc, vt, im, 2)","nb_nbi01_wetland_translation(wc, vt, im, 2)",Check there is a value. Translation converts source attributes into 4-character wetland code and returns the code corresponding to the second character.,TRUE
4,WET_LANDFORM_MOD,text,"nb_nbi01_wetland_validation(wc, vt, im, 3)","nb_nbi01_wetland_translation(wc, vt, im, 3)",Check there is a value.. Translation converts source attributes into 4-character wetland code and returns the code corresponding to the third character.,TRUE
5,WET_LOCAL_MOD,text,"nb_nbi01_wetland_validation(wc, vt, im, 4)","nb_nbi01_wetland_translation(wc, vt, im, 4)",Check there is a value. Translation converts source attributes into 4-character wetland code and returns the code corresponding to the fourth character.,TRUE
6,ECO_SITE,text,false(),nothingText(),Attribute does not occur,TRUE
