rule_id,target_attribute,target_attribute_type,validation_rules,translation_rules,description,desc_uptodate_with_rules
1,CAS_ID,text,notEmpty(inventory_id);notEmpty(src_filename);notNull(orig_stand_id);notNull(poly_id),"padConcat({inventory_id, src_filename, '', orig_stand_id, poly_id}, {4,15,10,10,7}, {'x','x','x','x','x'}, '-', TRUE, TRUE)",Concatenates five attributes to create CAS_ID,TRUE
2,INVENTORY_ID,text,notEmpty(inventory_id),copyText(inventory_id),Copies source value,TRUE
3,ORIG_STAND_ID,text,notNull(orig_stand_id),copyText(orig_stand_id),Copies source value,TRUE
4,STAND_STRUCTURE,text,"notEmpty({species_1, species_2, species_3, species_4}, TRUE|NOT_APPLICABLE)",copyText('SINGLE_LAYERED'),Stand structure is always SINGLE_LAYERED for forested polygons. Validation applies NOT_APPLICABLE unless polygon is forested.,TRUE
5,NUM_OF_LAYERS,integer,true(),copyInt(1),Always 1,TRUE
6,MAP_SHEET_ID,text,false(),nothingText(),Attribute does not occur,TRUE
7,CASFRI_AREA,double precision,"geoIsValid(wkb_geometry, TRUE|-8888)",geoArea(wkb_geometry),Validates geometry then calculates area,TRUE
8,CASFRI_PERIMETER,double precision,"geoIsValid(wkb_geometry, TRUE|-8888)",geoPerimeter(wkb_geometry),Validates geometry then calculates perimeter,TRUE
9,SRC_INV_AREA,double precision,"notNull(src_inv_area);isNumeric(src_inv_area);isGreaterThan(src_inv_area, 0, FALSE|-8888)","divideDouble(src_inv_area, 10000)",Convert source area from m2 to ha. Report any zero values as OUT_OF_RANGE.,TRUE
10,STAND_PHOTO_YEAR,integer,"notNull(stand_photo_year);isInt(stand_photo_year);isGreaterThan(stand_photo_year, 0, FALSE|-8888);isBetween(stand_photo_year, 1900, 2020)",copyInt(stand_photo_year),Copies source value to STAND_PHOTO_YEAR,TRUE
